{
  "schemaVersion": "3.0",
  "algorithm": "sha256-git-worktree-v1",
  "baselineCommit": "c4d47b287b5824ca8d205277171df1bd83953949",
  "workspaceDigest": "0f3f86f1e402a8ca24991d0a1b3fc1e27966f7e1680fe12478a4d9ea91858aa9",
  "clean": true,
  "symlinkFree": true,
  "submoduleFree": true,
  "verifiedAt": "2026-07-29T16:26:56.386Z"
}
